<?xml version="1.0" encoding="UTF-8"?>
<Product xmlns="ManufacturingPlan" id="P_03" description="Product3 (Base+Axis+Cover)" hierarchy_level="process" xmlns:xsi="http://www.w3.org/2001/XMLSchema-instance" xsi:schemaLocation="ManufacturingPlan Product.xsd">
  <complex_operation id="C_01" type="assembly" description="Assemble the cover with the unfinished product Base+Axis"/>
  <Product id="B_A" description="Unfinished product result of joining the base and the axis" hierarchy_level="process">
    <simple_operation id="S_02" type="insert_axis" description="Insert de axis in the base"/>
	<Product id="B" description="Base" hierarchy_level="process">
		<rawMaterial id="B" description="Base" resourceType="material"/>
	</Product>
  </Product>
  <Product id="C" description="Cover" hierarchy_level="process">
    <rawMaterial id="C" description="Cover" resourceType="material"/>
  </Product>
</Product>
